{
  "id":"sb_001","projectId":"project_10","createdBy":"user_7","sourceRunId":"run_generate_001","sourceSnapshot":{"scriptId":"script_101","scriptRevision":1,"sourceSceneId":"scene_12","sceneNo":1,"heading":"INT. 旧公寓客厅 - 夜","sceneText":"INT. 旧公寓客厅 - 夜\n\n雨敲着窗。许晴站在门边，没有进来。林舟从抽屉里拿出一封牛皮纸信，信封完整，封口未拆。\n\n许晴：你说有东西要给我。\n\n林舟把信藏到身后，停了两秒，又把它放到茶几上。\n\n林舟：不是现在。\n\n许晴走到茶几前，拿起那封未拆的信。她没有打开，只看着林舟。\n\n许晴：那我先替你保管。\n\n林舟没有回答。雨声更响了。","sceneHash":"d5a923751a6e721ee6159ca231cbf0c189f297995b1063cd5107b8da51d94a96"},"revision":1,"createdAt":"2026-10-06T08:00:00Z","updatedAt":"2026-10-06T08:00:00Z",
  "shots":[
    {"id":"shot_001","orderIndex":0,"shotSize":"ESTABLISHING","cameraMovement":"STATIC","visualDescription":"夜雨中的旧公寓客厅，许晴停在门边，林舟站在抽屉旁。","dialogue":"","sound":"雨敲着窗。","durationSeconds":5,"imagePrompt":"夜晚旧公寓客厅，冷色雨光，两人相隔，电影分镜，广角静态构图","videoPrompt":"5秒，静态广角，雨光映在客厅，许晴停在门边，林舟站在抽屉旁，无人移动","sourceQuote":"雨敲着窗。许晴站在门边，没有进来。"},
    {"id":"shot_002","orderIndex":1,"shotSize":"MEDIUM","cameraMovement":"DOLLY_IN","visualDescription":"林舟从抽屉拿出完整的牛皮纸信，镜头靠近清楚呈现未拆封口。","dialogue":"许晴：你说有东西要给我。","sound":"持续雨声。","durationSeconds":5,"imagePrompt":"林舟从旧抽屉取出未拆牛皮纸信，封口清晰，冷色电影中景，缓慢推近","videoPrompt":"5秒，中景缓慢推近，林舟从抽屉取出完整未拆的牛皮纸信，封口始终完整","sourceQuote":"林舟从抽屉里拿出一封牛皮纸信，信封完整，封口未拆。"},
    {"id":"shot_003","orderIndex":2,"shotSize":"MEDIUM","cameraMovement":"STATIC","visualDescription":"林舟把信藏到身后，望向门边的许晴，停顿两秒。","dialogue":"","sound":"雨声。","durationSeconds":4,"imagePrompt":"林舟把未拆牛皮纸信藏到身后，许晴在门边，紧张停顿，电影中景静态","videoPrompt":"4秒，中景静态，林舟把未拆信藏到身后并停顿，许晴保持门边位置","sourceQuote":"林舟把信藏到身后，停了两秒"},
    {"id":"shot_004","orderIndex":3,"shotSize":"CLOSE_UP","cameraMovement":"STATIC","visualDescription":"林舟把信放到茶几上，手离开信封，封口仍完整。","dialogue":"林舟：不是现在。","sound":"雨声压低。","durationSeconds":4,"imagePrompt":"茶几特写，林舟的手放下未拆牛皮纸信并离开，封口完整，低调雨夜电影光","videoPrompt":"4秒，静态特写，手把未拆信放到茶几后离开，信封封口保持完整","sourceQuote":"又把它放到茶几上。\n\n林舟：不是现在。"},
    {"id":"shot_005","orderIndex":4,"shotSize":"MEDIUM","cameraMovement":"TRACK","visualDescription":"许晴走到茶几前拿起未拆的信，抬眼看林舟，没有打开。","dialogue":"许晴：那我先替你保管。","sound":"雨声持续。","durationSeconds":5,"imagePrompt":"许晴走到茶几拿起未拆牛皮纸信，面对林舟，没有打开，电影中景侧向跟拍","videoPrompt":"5秒，中景跟拍，许晴走到茶几拿起未拆信并看向林舟，全程不拆信","sourceQuote":"许晴走到茶几前，拿起那封未拆的信。她没有打开，只看着林舟。"},
    {"id":"shot_006","orderIndex":5,"shotSize":"WIDE","cameraMovement":"STATIC","visualDescription":"两人隔着客厅沉默对视，许晴握着未拆的信，雨声更响。","dialogue":"","sound":"雨声更响了。","durationSeconds":5,"imagePrompt":"雨夜旧公寓客厅，两人隔开沉默对视，许晴手持未拆牛皮纸信，冷色电影广角","videoPrompt":"5秒，静态广角，两人沉默对视，许晴始终握着未拆信，窗外雨声加强","sourceQuote":"林舟没有回答。雨声更响了。"}
  ],"proposalSummaries":[]
}
