{
  "id": "a55499c7-a9aa-452e-9ad9-12266c65e219",
  "projectId": "2",
  "createdBy": "1",
  "sourceRunId": "ef36082d-5384-4a03-84b8-9df16d692398",
  "sourceSnapshot": {
    "scriptId": "2",
    "scriptRevision": 1,
    "sourceSceneId": "2",
    "sceneNo": 1,
    "heading": "INT. 旧公寓客厅 - 夜",
    "sceneText": "INT. 旧公寓客厅 - 夜\n\n雨敲着窗。许晴站在门边，没有进来。林舟从抽屉里拿出一封牛皮纸信，信封完整，封口未拆。\n\n许晴：你说有东西要给我。\n\n林舟把信藏到身后，停了两秒，又把它放到茶几上。\n\n林舟：不是现在。\n\n许晴走到茶几前，拿起那封未拆的信。她没有打开，只看着林舟。\n\n许晴：那我先替你保管。\n\n林舟没有回答。雨声更响了。",
    "sceneHash": "d5a923751a6e721ee6159ca231cbf0c189f297995b1063cd5107b8da51d94a96"
  },
  "revision": 1,
  "createdAt": "2026-10-07T12:39:51.609506Z",
  "updatedAt": "2026-10-07T12:39:51.609506Z",
  "shots": [
    {
      "id": "68017ce6-8df4-41e7-8175-ddf2a9ab946e",
      "orderIndex": 0,
      "shotSize": "ESTABLISHING",
      "cameraMovement": "STATIC",
      "visualDescription": "旧公寓客厅夜景，低色温冷调。窗外雨幕密集，雨滴顺着玻璃滑落，室内只有一盏昏黄台灯，光影斑驳在旧家具上，空间显得空旷而压抑。",
      "dialogue": "",
      "sound": "雨点敲打窗户的连绵声，低沉、均匀",
      "durationSeconds": 6,
      "imagePrompt": "cinematic establishing shot, old apartment living room at night, cold low color temperature, heavy rain streaking down window glass, single dim warm table lamp, worn vintage furniture, deep shadows, muted desaturated teal-blue palette, atmospheric haze, 35mm film look, shallow depth, moody restrained tone",
      "videoPrompt": "缓慢静态的定场镜头，雨丝持续滑落窗玻璃，窗帘随气流微微起伏，室内灯光几乎不闪动，画面冷静克制，冷蓝与暗黄对比强烈",
      "sourceQuote": "INT. 旧公寓客厅 - 夜\n\n雨敲着窗。"
    },
    {
      "id": "4875bcf6-8cc2-417d-bdc5-56dbee35f433",
      "orderIndex": 1,
      "shotSize": "WIDE",
      "cameraMovement": "DOLLY_IN",
      "visualDescription": "许晴站在门边，外套未脱下，身体留在门框外侧，脚尖没有跨过门槛。林舟在客厅深处，两人之间隔着一整段空荡的地板。",
      "dialogue": "",
      "sound": "雨声持续，远处隐约的车流声",
      "durationSeconds": 6,
      "imagePrompt": "wide shot, woman in coat standing at apartment doorway refusing to step in, man deep inside dim living room, large empty floor between them, cold low color temperature, rain-lit window backlight, silhouettes, restrained composition, negative space, cinematic realism, 35mm lens",
      "videoPrompt": "镜头极缓推近，从门口景象推向两人之间的空地，人物几乎静止，仅衣料与发丝轻微晃动，雨光在墙面移动，气氛克制悬停",
      "sourceQuote": "许晴站在门边，没有进来。"
    },
    {
      "id": "3cd798e2-9ee4-46fc-9828-74e8aaf1bbd0",
      "orderIndex": 2,
      "shotSize": "MEDIUM",
      "cameraMovement": "STATIC",
      "visualDescription": "林舟侧身对着抽屉，手伸进去取出一封牛皮纸信。信封棱角整齐，封口完好平整，没有撕开的痕迹。冷光照出纸张粗糙的纤维纹理。",
      "dialogue": "",
      "sound": "木抽屉拉开又合上的轻响，雨声底噪",
      "durationSeconds": 5,
      "imagePrompt": "medium shot, man's hands pulling a kraft paper envelope from an old wooden drawer, envelope intact and unopened, crisp sealed flap, rough paper fiber texture catching cold light, low color temperature, dramatic side light, shallow focus on the envelope, cinematic detail",
      "videoPrompt": "中景固定机位，手从抽屉里完整取出信封，动作缓慢且小心，光线在信封表面滑过一道冷反光，强调封口完好未拆，气氛安静紧张",
      "sourceQuote": "林舟从抽屉里拿出一封牛皮纸信，信封完整，封口未拆。"
    },
    {
      "id": "11880d78-d0cd-46eb-9faf-959b82253cdd",
      "orderIndex": 3,
      "shotSize": "CLOSE_UP",
      "cameraMovement": "STATIC",
      "visualDescription": "信封的特写，占据画面中央。封口边缘笔直干净，纸面因手指按压而微微凹陷，林舟的指节发白，透出用力与迟疑。",
      "dialogue": "",
      "sound": "雨声变得清晰，呼吸声轻微",
      "durationSeconds": 4,
      "imagePrompt": "extreme detail close-up of an unopened kraft envelope held by tense fingers, sealed flap unbroken, paper slightly dented under fingertip pressure, knuckles pale with tension, cold blue rim light, dark background, macro texture, cinematic, restrained mood",
      "videoPrompt": "特写静止镜头，手指在信封上极轻微收紧又松开一次，封口始终未被触碰，焦点牢牢锁在未拆的封口线上，雨声在背景逐渐加重",
      "sourceQuote": "信封完整，封口未拆。"
    },
    {
      "id": "29ad86fe-1193-44ea-8324-e7788fb5aec0",
      "orderIndex": 4,
      "shotSize": "MEDIUM",
      "cameraMovement": "HANDHELD",
      "visualDescription": "许晴开口，视线落在林舟身上。她仍站在门边，没有前进，肩膀紧绷，声音平静却克制。",
      "dialogue": "许晴：你说有东西要给我。",
      "sound": "雨声，人物清晰的说话声",
      "durationSeconds": 5,
      "imagePrompt": "medium shot of a woman standing by the door speaking quietly, tense shoulders, coat still on, gaze fixed forward, cold low color temperature, dim lamplight, soft handheld framing, cinematic realism, muted palette",
      "videoPrompt": "手持轻晃中景，人物开口说话，嘴唇与眼神细微变化，背景雨光闪动，镜头有呼吸感但不夸张，保持克制的夜雨氛围",
      "sourceQuote": "许晴：你说有东西要给我。"
    },
    {
      "id": "0f48263a-e3ed-44dc-b2b4-414f8613e8ad",
      "orderIndex": 5,
      "shotSize": "MEDIUM",
      "cameraMovement": "TRACK",
      "visualDescription": "林舟把信藏到身后，动作一顿，停了两秒，眼神避开许晴。随后他缓慢弯腰，把信平放在茶几上，手指在信上多停了一瞬才抽回。",
      "dialogue": "林舟：不是现在。",
      "sound": "雨声，信封落在玻璃茶几上的轻响",
      "durationSeconds": 8,
      "imagePrompt": "medium tracking shot, man hides an envelope behind his back then slowly places it on a glass coffee table, hesitant pause, averted eyes, cold low color temperature, dim lamp glow, restrained performance, cinematic realism, shallow depth",
      "videoPrompt": "镜头随人物动作缓慢横移跟随，先拍他把信藏在身后并停顿两秒，再跟随手臂下移把信放到茶几上，手指滞留一瞬后抽离，节奏压抑克制",
      "sourceQuote": "林舟把信藏到身后，停了两秒，又把它放到茶几上。\n\n林舟：不是现在。"
    },
    {
      "id": "b1a25729-aa4a-4cfa-8011-2e1b60add40c",
      "orderIndex": 6,
      "shotSize": "CLOSE_UP",
      "cameraMovement": "DOLLY_IN",
      "visualDescription": "许晴走到茶几前，低头拿起那封未拆的信。她拇指贴着封口，却没有拆开，随后抬眼看向林舟，眼神沉静而坚定。",
      "dialogue": "许晴：那我先替你保管。",
      "sound": "脚步声，纸张摩擦声，雨声持续",
      "durationSeconds": 7,
      "imagePrompt": "close-up, woman's hand picking up an unopened kraft envelope from a glass coffee table, thumb resting on the sealed flap without opening it, she raises her eyes, cold low color temperature, soft rain light, shallow focus, cinematic restrained emotion",
      "videoPrompt": "镜头缓缓推近，手拿起信封，拇指停在封口上没有撕开，随后焦点随视线转移到她的眼睛，眼神由低垂转为平稳注视，克制而有分量",
      "sourceQuote": "许晴走到茶几前，拿起那封未拆的信。她没有打开，只看着林舟。\n\n许晴：那我先替你保管。"
    },
    {
      "id": "5a4a5964-3f83-441f-9b78-2df36f2c62fb",
      "orderIndex": 7,
      "shotSize": "WIDE",
      "cameraMovement": "DOLLY_OUT",
      "visualDescription": "林舟沉默站着，没有回答。许晴握着信留在原处。镜头缓慢拉开，两人之间的空地被黑夜吞没，雨声盖过一切，画面在冷调中停住。",
      "dialogue": "",
      "sound": "雨声骤然变响，压过室内所有声音，久久持续",
      "durationSeconds": 7,
      "imagePrompt": "wide shot, silent man and a woman holding an unopened envelope standing apart in a dim living room, camera pulling back, cold low color temperature, heavy rain on the window dominating the frame, empty space between them, melancholic restrained atmosphere, cinematic 35mm",
      "videoPrompt": "镜头缓慢向后拉远，两人保持静止不动，雨势加强，雨光在窗面闪烁，画面逐渐被冷色阴影吞没，收尾安静压抑，只留雨声",
      "sourceQuote": "林舟没有回答。雨声更响了。"
    }
  ],
  "proposalSummaries": []
}
