{
  "id": "f2bc2e42-ef32-494f-a51a-59ef17650e12",
  "projectId": "3",
  "createdBy": "1",
  "sourceRunId": "13c3292b-ad70-4a7e-af4a-ec3ec0bbcdfd",
  "sourceSnapshot": {
    "scriptId": "3",
    "scriptRevision": 1,
    "sourceSceneId": "3",
    "sceneNo": 1,
    "heading": "INT. 医院安全楼梯 - 夜",
    "sceneText": "INT. 医院安全楼梯 - 夜\n\n楼道突然停电。陈默按亮手机手电，另一只手夹着蓝色文件夹。他刚迈下一级台阶，文件夹滑落，纸页散到下一层平台。\n\n身后的苏岚抓住扶手，没有移动。\n\n苏岚：别下去，门锁上了。\n\n陈默蹲在台阶上，用手电照向平台。他没有碰那扇门。\n\n苏岚把自己的钥匙递给陈默。陈默接过钥匙，仍蹲在原地，先把散页压回蓝色文件夹。\n\n远处应急灯亮起一盏。两人看见门锁还扣着。",
    "sceneHash": "dc069ca728d38ab135c2a66c56055e927569efb8e4725cf40ad6699da5dd1686"
  },
  "revision": 1,
  "createdAt": "2026-10-08T10:46:25.966156Z",
  "updatedAt": "2026-10-08T10:46:25.966156Z",
  "shots": [
    {
      "id": "3cf9235c-c01f-4363-8dc1-3306415110c9",
      "orderIndex": 0,
      "shotSize": "ESTABLISHING",
      "cameraMovement": "STATIC",
      "visualDescription": "医院安全楼梯间，夜色中突然停电，唯有手机屏幕亮起。陈默按亮手机手电，另一只手夹着蓝色文件夹，光柱扫过水泥台阶与扶手。苏岚在其身后抓住扶手。",
      "dialogue": "",
      "sound": "灯管熄灭的电流声戛然而止，楼梯间陷入安静，随后是手机手电开启的轻响",
      "durationSeconds": 4,
      "imagePrompt": "电影感写实画面，医院安全楼梯间夜间突然停电，唯一光源是男子手中的手机手电筒，光柱扫过灰色水泥台阶与金属扶手，男子另一只手夹着一个蓝色文件夹，身后一名女子双手抓住扶手站立不动，昏暗冷色调，浅景深，真实质感，竖屏构图",
      "videoPrompt": "镜头固定不动。医院安全楼梯间的灯突然全部熄灭，男演员按亮手机手电，光柱亮起并缓慢扫过台阶和扶手，他另一只手臂夹着蓝色文件夹；身后女演员抓住扶手保持不动。冷色调夜景，光线仅来自手机手电，写实电影质感，动作幅度小，氛围压抑安静",
      "sourceQuote": "楼道突然停电。陈默按亮手机手电，另一只手夹着蓝色文件夹。"
    },
    {
      "id": "6e424ab4-613e-48b5-b501-4866e745e038",
      "orderIndex": 1,
      "shotSize": "MEDIUM",
      "cameraMovement": "TILT",
      "visualDescription": "陈默刚迈下一级台阶，夹在臂下的蓝色文件夹滑脱，纸页翻飞飘落到下一层平台，手电光追着纸页下移。",
      "dialogue": "",
      "sound": "纸张摩擦与散落的哗啦声，鞋底在台阶上的轻微摩擦",
      "durationSeconds": 4,
      "imagePrompt": "电影感写实画面，男子在昏暗楼梯上迈下一级台阶，臂下夹着的蓝色文件夹滑落，白色纸页在空中翻飞飘散到下方平台，手机手电光柱追着纸页向下，动态瞬间定格，冷色调，浅景深，竖屏构图",
      "videoPrompt": "镜头轻微下摇跟随纸页。男子迈下一级台阶，夹在臂下的蓝色文件夹滑脱，纸页四散翻飞飘向下一层平台，手机手电光柱跟随纸页下移照出飞舞的纸面。动作连贯自然，写实电影质感，冷色调夜景，仅手机手电照明",
      "sourceQuote": "他刚迈下一级台阶，文件夹滑落，纸页散到下一层平台。"
    },
    {
      "id": "40d2812c-6388-47d6-a445-c4d476814439",
      "orderIndex": 2,
      "shotSize": "MEDIUM",
      "cameraMovement": "STATIC",
      "visualDescription": "苏岚在陈默身后紧抓扶手，身体重心后移，双脚没有移动，目光望向下方平台与那扇门。",
      "dialogue": "别下去，门锁上了。",
      "sound": "手掌压在金属扶手上的轻微摩擦声，安静的楼梯间回响",
      "durationSeconds": 5,
      "imagePrompt": "电影感写实画面，昏暗医院楼梯间，一名女子双手紧抓金属扶手，身体重心后移，双脚没有移动，侧身望向下方平台，表情克制紧张，后方男子手持手机手电形成逆光，冷色调，浅景深，竖屏构图",
      "videoPrompt": "镜头固定。女演员双手紧抓扶手，身体重心后移但双脚保持不动，微微侧头望向下方平台，嘴唇开合说出台词。她被后方手机手电逆光勾勒出轮廓，动作克制，写实电影质感，冷色调夜景",
      "sourceQuote": "身后的苏岚抓住扶手，没有移动。\n\n苏岚：别下去，门锁上了。"
    },
    {
      "id": "cf3efffb-f00f-4638-9336-40269fdfd9a0",
      "orderIndex": 3,
      "shotSize": "CLOSE_UP",
      "cameraMovement": "STATIC",
      "visualDescription": "陈默蹲在台阶上，用手电光柱照向下一层平台，光照出门的轮廓与扣着的门锁，他没有伸手去碰那扇门。",
      "dialogue": "",
      "sound": "手机手电稳定电流的微弱嗡声，远处管道滴水声",
      "durationSeconds": 5,
      "imagePrompt": "电影感写实画面，男子蹲在昏暗楼梯台阶上，手臂伸出用手机手电照向下一层平台，光柱照亮门的轮廓和扣着的门锁，他双手保持在原地没有触碰门，侧脸被手电余光打亮，冷色调，浅景深，写实质感，竖屏构图",
      "videoPrompt": "镜头固定。男演员蹲在台阶上，稳稳抬起手臂把手电光柱照向下一层平台，光斑缓慢移过门的表面，最终停在扣着的门锁上，他始终没有伸手触碰门。动作缓慢清晰，写实电影质感，冷色调，仅手机手电照明",
      "sourceQuote": "陈默蹲在台阶上，用手电照向平台。他没有碰那扇门。"
    },
    {
      "id": "7e4843c1-5247-4cf4-83d3-71e222e0a04f",
      "orderIndex": 4,
      "shotSize": "CLOSE_UP",
      "cameraMovement": "STATIC",
      "visualDescription": "苏岚把自己的钥匙递向陈默，金属钥匙在手机手电光下反光；陈默仍蹲在原地，双手接过钥匙。",
      "dialogue": "",
      "sound": "钥匙串轻碰的清脆金属声，衣物摩擦声",
      "durationSeconds": 4,
      "imagePrompt": "电影感写实画面，昏暗楼梯间特写，一只手把一串金属钥匙递给蹲着的男子，钥匙在手机手电光下反出冷光，男子伸手接住钥匙，背景是模糊的台阶与蓝色文件夹，冷色调，浅景深，写实质感，竖屏构图",
      "videoPrompt": "镜头固定近景。女演员伸手把钥匙串递向前方，男演员保持蹲姿用双手接过钥匙，钥匙在手机手电光下闪烁金属反光。动作克制缓慢，写实电影质感，冷色调夜景，环境保持昏暗",
      "sourceQuote": "苏岚把自己的钥匙递给陈默。陈默接过钥匙，仍蹲在原地，"
    },
    {
      "id": "322738d0-0e96-4ee3-bb8e-536ba5f7760e",
      "orderIndex": 5,
      "shotSize": "MEDIUM",
      "cameraMovement": "DOLLY_OUT",
      "visualDescription": "陈默蹲在原地，先把散页一张张压回蓝色文件夹；远处应急灯亮起一盏，微光下两人看见门锁仍扣着。",
      "dialogue": "",
      "sound": "纸张归拢压合的窸窣声，应急灯亮起时的细微电流声",
      "durationSeconds": 6,
      "imagePrompt": "电影感写实画面，昏暗医院楼梯间，男子蹲在台阶上把散落的纸页一张张压回蓝色文件夹，远处墙壁一盏应急灯亮起发出微绿白光，照亮下方平台与仍扣着的门锁，女子站在后方看向门锁，冷色调，写实质感，竖屏构图",
      "videoPrompt": "镜头缓慢后拉。男演员蹲在原地把散页一页页压回蓝色文件夹，背景远处墙壁上一盏应急灯亮起，微光逐渐照出下方平台与扣着的门锁，女演员在后方望向门锁。光线由单一手电过渡到加入应急灯冷光，写实电影质感，动作缓慢安静",
      "sourceQuote": "先把散页压回蓝色文件夹。\n\n远处应急灯亮起一盏。两人看见门锁还扣着。"
    }
  ],
  "proposalSummaries": []
}
