{
  "id": "be29bb7c-28fc-4d0c-9232-2af921ed1784",
  "projectId": "5",
  "createdBy": "1",
  "sourceRunId": "9b0f71b0-07bf-4bfb-850d-9f9de08cfd80",
  "sourceSnapshot": {
    "scriptId": "5",
    "scriptRevision": 1,
    "sourceSceneId": "5",
    "sceneNo": "1",
    "heading": "EXT. 城郊站台 - 清晨",
    "sceneText": "EXT. 城郊站台 - 清晨\n\n雾贴着空站台。自动售票机的蓝光闪烁，一张被雨水打湿的车票贴在长椅脚边。\n\n清洁工推着空车从画面远处经过，没有停下。铁轨尽头传来很远的鸟叫，没有列车进站。\n\n风把车票吹到黄线前，又停住。雾慢慢遮住铁轨。",
    "sceneHash": "e944910af6327fa91f22cddac2442dd40fcf24958bee3003b4da0b6d30f759d5"
  },
  "revision": 1,
  "createdAt": "2026-10-08T18:46:50.421204+08:00",
  "updatedAt": "2026-10-08T18:46:50.421204+08:00",
  "shots": [
    {
      "id": "acb7c67c-2b84-4673-accd-ddc481d7c328",
      "orderIndex": 0,
      "shotSize": "ESTABLISHING",
      "cameraMovement": "STATIC",
      "visualDescription": "清晨的城郊站台，浓雾几乎贴着地面铺满整个空站台，远景的铁轨被雾吞没，只余模糊的轮廓。画面一侧自动售票机透出冷调蓝光，在湿地上晕开一小片光斑，空荡的站台上没有任何人影与列车。",
      "dialogue": "",
      "sound": "清晨极低的底噪，远处偶尔一声很远的鸟叫，无列车声",
      "durationSeconds": 7,
      "imagePrompt": "电影感定场镜头，清晨城郊露天站台，浓雾贴着地面铺满空站台，潮湿的水泥地反光，画面一侧自动售票机发出冷蓝色光晕并在湿地面投下光斑，远景铁轨被雾吞没轮廓模糊，冷蓝与灰白主色调，天色微亮的青灰晨光，无人物，超写实，浅景深，35mm 质感，胶片颗粒",
      "videoPrompt": "固定机位定场镜头，浓雾缓慢流动并微微贴地翻涌，自动售票机蓝光轻轻闪烁一下，湿地光斑轻微晃动，远处鸟叫一声，画面保持静止的清晨寂静氛围，无列车进站，缓慢自然的光线渐变",
      "sourceQuote": "雾贴着空站台。自动售票机的蓝光闪烁，一张被雨水打湿的车票贴在长椅脚边。"
    },
    {
      "id": "bf540ce5-c574-422d-a5f4-4f94e857671b",
      "orderIndex": 1,
      "shotSize": "CLOSE_UP",
      "cameraMovement": "STATIC",
      "visualDescription": "特写长椅的金属椅脚，一张被雨水打湿的车票紧贴在椅脚边的湿地上，纸面皱起、字迹被水浸得晕开，边缘卷起。自动售票机的蓝光斜斜地落在车票上，映出一小片冷蓝的湿润反光。",
      "dialogue": "",
      "sound": "极轻的风声，细微的水滴声",
      "durationSeconds": 5,
      "imagePrompt": "特写镜头，湿漉漉的站台地面上，一张被雨水浸透的纸质车票贴靠在旧金属长椅椅脚边，纸张起皱卷边、印刷字迹被水晕开，冷蓝色光线从侧上方斜射在车票表面形成湿润反光，浅景深，背景雾化虚糊，写实质感，微距细节丰富，冷调胶片色彩",
      "videoPrompt": "固定特写机位，车票湿润纸面在蓝光下微微反光，水珠沿纸边缓缓滑落一滴，风轻轻掀起车票一角又落下，蓝光有节奏地轻闪，浅景深背景持续虚化，氛围安静冷凝",
      "sourceQuote": "一张被雨水打湿的车票贴在长椅脚边。"
    },
    {
      "id": "b77d22bb-3e10-4369-a3b0-7f06127be860",
      "orderIndex": 2,
      "shotSize": "WIDE",
      "cameraMovement": "PAN",
      "visualDescription": "站台纵深方向，清洁工推着一辆空车从画面远处缓缓经过，身影在浓雾中只有模糊的剪影。空车在湿地面上滚动，没有停下，也没有看向长椅方向。雾在远处把清洁工的轮廓一点点吞掉。",
      "dialogue": "",
      "sound": "空车金属轮在湿地面上滚动的细碎声响，由远及近再渐远，晨风低鸣",
      "durationSeconds": 8,
      "imagePrompt": "宽幅全景，清晨浓雾中的城郊站台纵深，一位清洁工推着空车从远处雾中经过形成模糊剪影，空车在潮湿地面上留下反光水痕，站台空无一人，冷蓝灰调，雾气形成强烈空气透视，逆光中微亮的天光，写实电影摄影，长焦压缩纵深",
      "videoPrompt": "横向跟摇镜头，清洁工推着空车顺着站台纵深缓慢前行，从画面一侧入画、经过、再从另一侧出画，始终不停步也不转头，雾气持续吞没其轮廓，湿地面反光随移动轻微拉伸，无列车出现",
      "sourceQuote": "清洁工推着空车从画面远处经过，没有停下。"
    },
    {
      "id": "8adc04df-d8f5-42dd-9de3-4712c67ef189",
      "orderIndex": 3,
      "shotSize": "CLOSE_UP",
      "cameraMovement": "DOLLY_IN",
      "visualDescription": "车票被风从长椅脚边吹向站台黄线，在黄线前突然停住，贴在地面上轻轻颤动。摄影机缓缓推近，最后画面被缓缓漫上的浓雾一点点遮住，铁轨与黄线都消失在白茫茫的雾中，只剩一片清晨的灰白。",
      "dialogue": "",
      "sound": "风的呼啸渐强，鸟叫远去，随后只剩一片沉闷的雾中静默",
      "durationSeconds": 9,
      "imagePrompt": "低角度特写，一张湿透的车票被风吹到站台黄色安全线前停住，贴地轻颤，画面上方前景浓雾缓慢漫过并逐渐遮挡视线，铁轨在雾中消失，冷蓝灰白色调，清晨空旷氛围，浅景深，写实电影级质感，胶片颗粒",
      "videoPrompt": "低机位缓慢推近镜头，车票被一阵风推动滑到黄色安全线前骤然停住、贴地颤动，随后浓雾从前向后缓慢漫过画面，逐渐吞没车票、黄线与铁轨，最终画面几乎被雾充满，全程无列车进站，结尾归于静止",
      "sourceQuote": "风把车票吹到黄线前，又停住。雾慢慢遮住铁轨。"
    }
  ],
  "proposalSummaries": []
}
