{
  "id": "3e9880ac-0986-4867-a04b-cbb1ee794605",
  "projectId": "1",
  "createdBy": "1",
  "sourceRunId": "421bbb1b-fcf6-4052-b3a5-8ea4cd619e06",
  "sourceSnapshot": {
    "scriptId": "1",
    "scriptRevision": 1,
    "sourceSceneId": "1",
    "sceneNo": 1,
    "heading": "INT. 旧公寓客厅 - 夜",
    "sceneText": "INT. 旧公寓客厅 - 夜\n\n雨敲着窗。许晴站在门边，没有进来。林舟从抽屉里拿出一封牛皮纸信，信封完整，封口未拆。\n\n许晴：你说有东西要给我。\n\n林舟把信藏到身后，停了两秒，又把它放到茶几上。\n\n林舟：不是现在。\n\n许晴走到茶几前，拿起那封未拆的信。她没有打开，只看着林舟。\n\n许晴：那我先替你保管。\n\n林舟没有回答。雨声更响了。",
    "sceneHash": "d5a923751a6e721ee6159ca231cbf0c189f297995b1063cd5107b8da51d94a96"
  },
  "revision": 1,
  "createdAt": "2026-10-08T10:46:01.737323Z",
  "updatedAt": "2026-10-08T10:46:01.737323Z",
  "shots": [
    {
      "id": "36b9672a-4898-4724-84f3-d385737fc550",
      "orderIndex": 0,
      "shotSize": "ESTABLISHING",
      "cameraMovement": "STATIC",
      "visualDescription": "夜，旧公寓客厅。低色温冷调，窗玻璃上雨水被风推成斜线，室内只有一盏旧台灯与窗外路灯的微光。房间陈设简朴，门半开，许晴的身影立在门边没有进来。空气里是被雨声填满的安静。",
      "dialogue": "",
      "sound": "密集夜雨敲窗，雨声几乎盖住环境底噪；远处偶尔一声车辆驶过积水的闷响。",
      "durationSeconds": 5,
      "imagePrompt": "夜景旧公寓客厅establishing shot，冷蓝低色温，斜雨打在窗玻璃上，室内单盏暖黄旧台灯与窗外冷路灯形成对比，门半开，门口一个女性剪影未入内，极简陈设，浅景深，35mm 电影感，颗粒质感，克制写实，无字幕",
      "videoPrompt": "静止广角全景，缓慢感受雨势变化，镜头固定不动；窗上雨痕流动，窗帘被风微微掀动，台灯的光轻轻呼吸；冷蓝调，低饱和，高对比阴影；实际拍摄质感，24fps 微动，机位稳定无推拉",
      "sourceQuote": "INT. 旧公寓客厅 - 夜"
    },
    {
      "id": "68d2ca0b-9898-49f2-977b-38ccd1f45a9c",
      "orderIndex": 1,
      "shotSize": "MEDIUM",
      "cameraMovement": "STATIC",
      "visualDescription": "许晴站在门边，外套肩线带着雨气，双手自然垂下，没有跨过门槛。她的视线越过房间，落在林舟身上，表情平静但专注，没有催促。",
      "dialogue": "",
      "sound": "雨声持续，门口方向有微弱的风声与雨点溅落声。",
      "durationSeconds": 4,
      "imagePrompt": "中景，女性角色站在旧公寓门边，肩上带雨水痕迹，不跨过门槛，身体微前倾但克制的站姿，侧逆光冷调，面部半明半暗，浅景深虚化客厅背景，写实电影打光，低饱和青蓝，无字幕",
      "videoPrompt": "中景固定机位，近似呼吸的轻微手持 stabilization；她保持静止，只有眼神从门口移向房间深处，睫毛与发丝被门口气流传动；冷蓝侧光，克制的雨夜氛围，24fps",
      "sourceQuote": "许晴站在门边，没有进来。"
    },
    {
      "id": "dfb92da7-954e-431b-9915-28a0f0a69a38",
      "orderIndex": 2,
      "shotSize": "CLOSE_UP",
      "cameraMovement": "DOLLY_IN",
      "visualDescription": "林舟的手从抽屉中取出一封牛皮纸信。信封完整平整，边角没有折痕，封口处干净未拆，纸质粗糙泛着暖褐。抽屉内部昏暗，手部动作小心而迟疑。",
      "dialogue": "",
      "sound": "木质抽屉被拉开的摩擦声，纸封信被拿起的轻微沙响，雨声作为持续底层。",
      "durationSeconds": 4,
      "imagePrompt": "特写，成年男性双手从昏暗抽屉取出一封完好的牛皮纸信封，封口完好未拆，纸张粗糙质感，暖褐色信封与冷蓝环境光对比，手部微颤细节，浅景深，写实材质，电影级打光，无字幕",
      "videoPrompt": "特写缓慢推近，镜头随取信动作轻推；手指捏住信封边缘抬出抽屉，尘埃在冷光里浮动；冷蓝主光加深阴影，暖褐信封成为唯一暖点；克制匀速推镜，24fps",
      "sourceQuote": "林舟从抽屉里拿出一封牛皮纸信，信封完整，封口未拆。"
    },
    {
      "id": "cf88a2a1-a0fe-4f4c-b953-005a69dc9d38",
      "orderIndex": 3,
      "shotSize": "MEDIUM",
      "cameraMovement": "STATIC",
      "visualDescription": "许晴站在门边看向林舟，声音不高。林舟在画面前景侧身，手里握着那封信，还没决定去向。两人之间隔着整个客厅的长度。",
      "dialogue": "许晴：你说有东西要给我。",
      "sound": "台词清晰压低，雨声在句间留白处更明显。",
      "durationSeconds": 4,
      "imagePrompt": "中景双人构图，女性立于门边过肩视角看向室内男性，男性侧身手握牛皮纸信封，两人被客厅纵深分隔，冷蓝雨夜打光，低饱和，边缘光勾勒轮廓，写实电影质感，无字幕",
      "videoPrompt": "中景固定机位，过肩构图；她说出台词时只有胸口轻微起伏，男性不动，信封在他手中被握紧又松开一点；雨光在窗上闪烁映进室内；24fps 极稳",
      "sourceQuote": "许晴：你说有东西要给我。"
    },
    {
      "id": "8a6f0d48-9809-4236-8461-d2f284474c12",
      "orderIndex": 4,
      "shotSize": "CLOSE_UP",
      "cameraMovement": "HANDHELD",
      "visualDescription": "林舟下意识把信藏到身后，手臂绷紧，视线避开许晴。镜头略近、略晃，捕捉他的犹豫。停了两秒，他的胸口起伏一次，随即把信重新拿出，放到茶几上，动作放得很轻。",
      "dialogue": "",
      "sound": "衣料摩擦声，信封落在茶几木面的轻响，雨声持续压着底噪。",
      "durationSeconds": 7,
      "imagePrompt": "特写至中近景，男性把信封藏到身后的手臂动作，随后把信封放到木质茶几上，手部与表情交错，冷蓝低色温，面部阴影重，眼神回避，浅景深，轻微手持抖动，写实电影，无字幕",
      "videoPrompt": "手持近景轻微晃动，跟随动作顺序：藏到身后—停顿两秒—放到茶几；镜头随他手臂下移轻跟再回正，呼吸可见，停顿处画面几乎静止，只有雨光在窗上动；24fps 自然抖动",
      "sourceQuote": "林舟把信藏到身后，停了两秒，又把它放到茶几上。"
    },
    {
      "id": "2c5de25b-7895-4ea4-95a4-34d80033a007",
      "orderIndex": 5,
      "shotSize": "CLOSE_UP",
      "cameraMovement": "STATIC",
      "visualDescription": "林舟的近景，茶几就在身侧。他开口，语气平淡收着，目光落在信封而不是许晴脸上。冷光从他侧后方掠过，半边脸处在阴影里。",
      "dialogue": "林舟：不是现在。",
      "sound": "台词低沉克制，说完的空白里只剩雨声。",
      "durationSeconds": 3,
      "imagePrompt": "男性近景，侧逆冷光，半脸阴影，视线垂向身侧茶几上的牛皮纸信封，唇部微动，表情压抑克制，低饱和青蓝，浅景深，写实电影质感，无字幕",
      "videoPrompt": "近景固定机位；他说话时几乎不动，只有喉结与嘴唇轻动，说完后眼神仍停在信封上；窗外雨光在脸上划过一道淡淡反光；24fps 静止",
      "sourceQuote": "林舟：不是现在。"
    },
    {
      "id": "12ecb1dc-01cf-422d-86b9-58ddf6ab1a6f",
      "orderIndex": 6,
      "shotSize": "MEDIUM",
      "cameraMovement": "TRACK",
      "visualDescription": "许晴终于跨过门槛走进客厅，走到茶几前，俯身拿起那封未拆的信。她没有打开，只是握着它，抬眼看林舟。动作缓慢，没有多余情绪。",
      "dialogue": "",
      "sound": "她的脚步声在木地板上轻响两下，信封被拿起的纸质轻响，雨声继续。",
      "durationSeconds": 6,
      "imagePrompt": "中景，女性走进客厅走到木质茶几前，俯身拿起完好的牛皮纸信封，未拆封，随后直起身看向画面外的男性，冷蓝夜雨打光，湿气感，低饱和，写实电影，浅景深，无字幕",
      "videoPrompt": "中景跟随镜头，横移跟随她走向茶几；俯身—拿起信封—直起身，动作连贯克制；镜头随她停稳后轻微减速停住；冷蓝雨水反光在地板流动；24fps 平滑跟拍",
      "sourceQuote": "许晴走到茶几前，拿起那封未拆的信。"
    },
    {
      "id": "2ad15354-7ca7-427e-a0e5-162606138e6a",
      "orderIndex": 7,
      "shotSize": "CLOSE_UP",
      "cameraMovement": "DOLLY_OUT",
      "visualDescription": "许晴握着未拆的信，指节放松地贴着信封边缘，视线落向林舟，安静而坚定。林舟没有回答，只站在原处。镜头缓缓后退，两人之间的距离和雨声一同把人压住。",
      "dialogue": "许晴：那我先替你保管。",
      "sound": "台词平静；说完雨声骤然更响，敲窗声密集，房间归于沉默。",
      "durationSeconds": 8,
      "imagePrompt": "近景，女性双手握着未拆封的牛皮纸信封，指节轻贴信封边缘，目光直视画面外的男性，冷蓝低色温，窗上雨痕作为背景虚化光斑，克制坚定的表情，写实电影，浅景深，无字幕",
      "videoPrompt": "近景缓慢后拉，镜头随台词结束后继续轻退；她说台词时静止，之后雨声变强，窗上雨痕流动加剧，画面渐入沉默；冷蓝高对比，低饱和，24fps 平稳后拉",
      "sourceQuote": "许晴：那我先替你保管。"
    }
  ],
  "proposalSummaries": []
}
